{
  "schemaVersion": 1,
  "name": "CapFoundry.geo.distance",
  "version": "1.0.0",
  "description": "Calculate the great-circle distance between two geographic coordinates",
  "aliases": [
    "haversine",
    "great circle distance",
    "distance between coordinates",
    "how far apart are two points",
    "kilometres between two places",
    "lat lon distance"
  ],
  "exampleQueries": [
    "calculate distance between two latitude longitude coordinates",
    "how many kilometres between these two GPS points",
    "great circle distance between two places on earth",
    "how far apart are two coordinates in miles",
    "compute haversine distance between two positions"
  ],
  "tags": [
    "geo",
    "geography",
    "math",
    "coordinates",
    "haversine",
    "gps"
  ],
  "inputSummary": "Two WGS-84 points as lat/lon degrees, plus an optional unit",
  "outputSummary": "Great-circle distance as a number in the requested unit",
  "runtime": "deno",
  "effect": "PURE",
  "inputSchema": {
    "type": "object",
    "additionalProperties": false,
    "required": [
      "from",
      "to"
    ],
    "properties": {
      "from": {
        "$ref": "#/$defs/point"
      },
      "to": {
        "$ref": "#/$defs/point"
      },
      "unit": {
        "enum": [
          "km",
          "m",
          "mi",
          "nmi"
        ]
      }
    },
    "$defs": {
      "point": {
        "type": "object",
        "additionalProperties": false,
        "required": [
          "lat",
          "lon"
        ],
        "properties": {
          "lat": {
            "type": "number",
            "minimum": -90,
            "maximum": 90
          },
          "lon": {
            "type": "number",
            "minimum": -180,
            "maximum": 180
          }
        }
      }
    }
  },
  "outputSchema": {
    "type": "object",
    "additionalProperties": false,
    "required": [
      "distance",
      "unit",
      "method"
    ],
    "properties": {
      "distance": {
        "type": "number",
        "minimum": 0
      },
      "unit": {
        "enum": [
          "km",
          "m",
          "mi",
          "nmi"
        ]
      },
      "method": {
        "const": "haversine"
      }
    }
  },
  "artifact": {
    "type": "typescript",
    "entrypoint": "./artifact/index.ts",
    "sha256": "9c3ef3aa9b89bfe75ea1ade09c66cf95b21dd0e5747389ae925f64511723ce97"
  },
  "exposure": {
    "execution": true,
    "artifact": true
  },
  "limits": {
    "timeoutMs": 5000
  },
  "tests": "./tests/"
}
